,category,sub_category,href,items,price,category_mean_price,sub_cat_mean_price
0,Groceries,Fruits & Vegetables,https://www.jiomart.com/c/groceries/fruits-vegetables/fresh-fruits/220,Fresh Dates (Pack) (Approx 450 g - 500 g),109.0,174.0,84.0
1,Groceries,Fruits & Vegetables,https://www.jiomart.com/c/groceries/fruits-vegetables/fresh-fruits/220,Fresh Dates (Pack) (Approx 450 g - 500 g),109.0,174.0,84.0
2,Groceries,Fruits & Vegetables,https://www.jiomart.com/c/groceries/fruits-vegetables/fresh-fruits/220,Tender Coconut Cling Wrapped (1 pc) (Approx 900 g - 1300 g),49.0,174.0,84.0
3,Groceries,Fruits & Vegetables,https://www.jiomart.com/c/groceries/fruits-vegetables/fresh-fruits/220,Mosambi 1 kg,69.0,174.0,84.0
4,Groceries,Premium Fruits,https://www.jiomart.com/c/groceries/premium-fruits/avocado-peach-plum/3108,Peach Sun Gold Premium Indian Pack 500 g,149.0,174.0,156.0
5,Groceries,Premium Fruits,https://www.jiomart.com/c/groceries/premium-fruits/avocado-peach-plum/3108,Plum Premium Indian Pack 500 g,149.0,174.0,156.0
6,Groceries,Premium Fruits,https://www.jiomart.com/c/groceries/premium-fruits/avocado-peach-plum/3108,Apricot Premium Indian Pack 500 g,169.0,174.0,156.0
7,Groceries,Dairy & Bakery,https://www.jiomart.com/c/groceries/dairy-bakery/dairy/62,Parle Agro Smoodh Toffee Caramel Milkshake 85 ml (Tetra Pak),9.0,174.0,88.0
8,Groceries,Dairy & Bakery,https://www.jiomart.com/c/groceries/dairy-bakery/dairy/62,Parle Agro Smoodh Chocolate Milkshake 85 ml (Tetra Pak),9.0,174.0,88.0
9,Groceries,Dairy & Bakery,https://www.jiomart.com/c/groceries/dairy-bakery/dairy/62,Amul Butter 500 g (Carton),245.0,174.0,88.0
10,Groceries,Staples,https://www.jiomart.com/c/groceries/staples/atta-flours-sooji/26,Chakki Atta 10 kg,309.0,174.0,122.0
11,Groceries,Staples,https://www.jiomart.com/c/groceries/staples/atta-flours-sooji/26,Suji / Rawa 1 kg,38.0,174.0,122.0
12,Groceries,Staples,https://www.jiomart.com/c/groceries/staples/atta-flours-sooji/26,Suji / Rawa 500 g,18.0,174.0,122.0
13,Groceries,Snacks & Branded Foods,https://www.jiomart.com/c/groceries/snacks-branded-foods/biscuits-cookies/11,Cadbury Oreo Original Vanilla Creme Biscuits 300 g,57.0,174.0,45.0
14,Groceries,Snacks & Branded Foods,https://www.jiomart.com/c/groceries/snacks-branded-foods/biscuits-cookies/11,Cadbury Oreo Choco Creme Biscuits 300 g,57.0,174.0,45.0
15,Groceries,Snacks & Branded Foods,https://www.jiomart.com/c/groceries/snacks-branded-foods/biscuits-cookies/11,Parle Hide & Seek Chocolate Chip Cookies 100 g,22.0,174.0,45.0
16,Groceries,Beverages,https://www.jiomart.com/c/groceries/beverages/tea/34,Taj Mahal Tea 500 g (Carton),340.0,174.0,195.0
17,Groceries,Beverages,https://www.jiomart.com/c/groceries/beverages/tea/34,Tata Agni Tea 1 kg,195.0,174.0,195.0
18,Groceries,Beverages,https://www.jiomart.com/c/groceries/beverages/tea/34,Tata Agni Tea 250 g,51.0,174.0,195.0
19,Groceries,Personal Care,https://www.jiomart.com/c/groceries/personal-care/hair-care/92,Get Real Coconut Oil 500 ml,145.0,174.0,112.0
20,Groceries,Personal Care,https://www.jiomart.com/c/groceries/personal-care/hair-care/92,Get Real Coconut Hair Oil 250 ml,62.0,174.0,112.0
21,Groceries,Personal Care,https://www.jiomart.com/c/groceries/personal-care/hair-care/92,Dabur Anmol Gold Pure Coconut Oil 600 ml,130.0,174.0,112.0
22,Groceries,Home Care,https://www.jiomart.com/c/groceries/home-care/detergents/37,Rin Ala Fabric Whitener 500 ml,68.0,174.0,89.0
23,Groceries,Home Care,https://www.jiomart.com/c/groceries/home-care/detergents/37,Comfort After Wash Morning Fresh Fabric Conditioner 860 ml,190.0,174.0,89.0
24,Groceries,Home Care,https://www.jiomart.com/c/groceries/home-care/detergents/37,Rin Detergent Bar 140 g,9.0,174.0,89.0
25,Groceries,Apparel,https://www.jiomart.com/c/groceries/apparel/menswear/1383,Savage Boys Cotton Underwear for 11 to 12 years old with Inner Elastic 75cm Pack of 3,299.0,174.0,399.0
26,Groceries,Apparel,https://www.jiomart.com/c/groceries/apparel/menswear/1383,Savage Boys Cotton Underwear for 11 to 12 years old with Inner Elastic 75cm Pack of 6,449.0,174.0,399.0
27,Groceries,Apparel,https://www.jiomart.com/c/groceries/apparel/menswear/1383,Savage Boys Cotton Underwear for 9 to 10 years old with Inner Elastic 70cm Pack of 6,449.0,174.0,399.0
28,Groceries,Mom & Baby Care,https://www.jiomart.com/c/groceries/mom-baby-care/feeding/2552,U-Grow Purple Silicone Baby Bottle Cleaning Brush (Pack of 3),436.0,174.0,300.0
29,Groceries,Mom & Baby Care,https://www.jiomart.com/c/groceries/mom-baby-care/feeding/2552,Infantso Blue Bottle Shape Food Grade Silicone Non-Toxic Baby Teether (2+ M),265.0,174.0,300.0
30,Groceries,Mom & Baby Care,https://www.jiomart.com/c/groceries/mom-baby-care/feeding/2552,"Kuber Industries Lining Design Cotton Premium Collection Handkerchiefs For Men,Set of 6 (White)",199.0,174.0,300.0
31,Groceries,Books,https://www.jiomart.com/c/groceries/books/children-s-books/2832,Quixot 225 Activity Book,75.0,174.0,75.0
32,Groceries,Books,https://www.jiomart.com/c/groceries/books/children-s-books/2832,My Big Book of Art & Craft Activity Book,75.0,174.0,75.0
33,Groceries,Books,https://www.jiomart.com/c/groceries/books/children-s-books/2832,Quixot Write Along Activity Book 40 pgs (3 + yrs),75.0,174.0,75.0
34,Groceries,Pets,https://www.jiomart.com/c/groceries/pets/dogs/3347,"Bark Out Loud by Vivaldis - Allergy & Itch Relief Shampoo- Effective on Food, Flea Allergy Rashes & Long Lasting Skin Conditions 200ml (Dogs & Cats)",300.0,174.0,451.0
35,Groceries,Pets,https://www.jiomart.com/c/groceries/pets/dogs/3347,Boltz Anti-Itching And Anti-Dandruff Dog Shampoo Oatmeal Apple Cider Vinegar -200 ml,249.0,174.0,451.0
36,Groceries,Pets,https://www.jiomart.com/c/groceries/pets/dogs/3347,Captain Zack Tazsoothe Itch Relief Af And Oatmeal Spray For Dogs 250 ml,805.0,174.0,451.0
37,Home & Kitchen,Kitchenware,https://www.jiomart.com/c/groceries/home-kitchen/kitchenware/cookware-non-stick/1711,Home One Premium Stainless Steel Bowl (No. 55),35.0,1119.0,378.0
38,Home & Kitchen,Kitchenware,https://www.jiomart.com/c/groceries/home-kitchen/kitchenware/cookware-non-stick/1711,Home One Stainless Steel Induction Bottom Kadai (Size 12),299.0,1119.0,378.0
39,Home & Kitchen,Kitchenware,https://www.jiomart.com/c/groceries/home-kitchen/kitchenware/cookware-non-stick/1711,Srushti Gold Round Aluminium Pressure Cooker 2+3 L (Set of 2) Single Lid,799.0,1119.0,378.0
40,Home & Kitchen,Dining,https://www.jiomart.com/c/groceries/home-kitchen/dining/cups-mugs-more/1713,Lexus Comfort Assorted Ceramic Mug 140 ml (Set of 6),109.0,1119.0,338.0
41,Home & Kitchen,Dining,https://www.jiomart.com/c/groceries/home-kitchen/dining/cups-mugs-more/1713,Lexus Assorted Ceramic Mug 140 ml (Set of 6),109.0,1119.0,338.0
42,Home & Kitchen,Dining,https://www.jiomart.com/c/groceries/home-kitchen/dining/cups-mugs-more/1713,Ebun Stainless Steel Double Wall Insulated Tea and Coffee Cups with Tray 60 ml (7 pcs),795.0,1119.0,338.0
43,Home & Kitchen,Furnishing,https://www.jiomart.com/c/groceries/home-kitchen/furnishing/towels/1697,SKAP Micro Fiber Wash Basin Towel 30x40 cm (Assorted Colours),49.0,1119.0,69.0
44,Home & Kitchen,Furnishing,https://www.jiomart.com/c/groceries/home-kitchen/furnishing/towels/1697,Home One White Cotton Hankerchief for Men 42x42 cm (Pack of 5),99.0,1119.0,69.0
45,Home & Kitchen,Furnishing,https://www.jiomart.com/c/groceries/home-kitchen/furnishing/towels/1697,Home One Multicolour Cotton Face Towel Set 28x28 cm (3 pcs),59.0,1119.0,69.0
46,Home & Kitchen,Home Decor,https://www.jiomart.com/c/groceries/home-kitchen/home-decor/artwork/2336,Ecraftindia Laughing Buddha Design UV Art Painting 35 X 50 cm,100.0,1119.0,133.0
47,Home & Kitchen,Home Decor,https://www.jiomart.com/c/groceries/home-kitchen/home-decor/artwork/2336,Ecraftindia Radha Krishna Matt Texture UV Art Painting 35 X 27 cm,149.0,1119.0,133.0
48,Home & Kitchen,Home Decor,https://www.jiomart.com/c/groceries/home-kitchen/home-decor/artwork/2336,Ecraftindia Matt Texture Art Painting (Set Of 3) 17 X 40 cm,150.0,1119.0,133.0
49,Home & Kitchen,Furniture,https://www.jiomart.com/c/groceries/home-kitchen/furniture/chairs-stools/1707,Home One Blue Plastic Foldable Table 63x36.5x24 cm,499.0,1119.0,399.0
50,Home & Kitchen,Furniture,https://www.jiomart.com/c/groceries/home-kitchen/furniture/chairs-stools/1707,Home One Pink Plastic Foldable Table 63x36.5x24 cm,499.0,1119.0,399.0
51,Home & Kitchen,Furniture,https://www.jiomart.com/c/groceries/home-kitchen/furniture/chairs-stools/1707,Home One Robo Brown and Beige Plastic Stool (Small),199.0,1119.0,399.0
52,Home & Kitchen,Home Appliances,https://www.jiomart.com/c/groceries/home-kitchen/home-appliances/personal-electronics/1703,B09SNNVMB4,6199.0,1119.0,2816.0
53,Home & Kitchen,Home Appliances,https://www.jiomart.com/c/groceries/home-kitchen/home-appliances/kitchen-appliances/1738,Everest Green Steel Coconut Opener,49.0,1119.0,2816.0
54,Home & Kitchen,Home Appliances,https://www.jiomart.com/c/groceries/home-kitchen/home-appliances/kitchen-appliances/1738,Black Product,2200.0,1119.0,2816.0
55,Home & Kitchen,"Toys, Games & Fitness",https://www.jiomart.com/c/groceries/home-kitchen/toys-games-fitness/sporting-equipment-accessories/1705,Elan Superlara Assorted Football (Size 5),249.0,1119.0,142.0
56,Home & Kitchen,"Toys, Games & Fitness",https://www.jiomart.com/c/groceries/home-kitchen/toys-games-fitness/sporting-equipment-accessories/1705,MS Plastic Skipping Rope,49.0,1119.0,142.0
57,Home & Kitchen,"Toys, Games & Fitness",https://www.jiomart.com/c/groceries/home-kitchen/toys-games-fitness/sporting-equipment-accessories/1705,Elan Cricket Tennis Ball (Pack of 3),129.0,1119.0,142.0
58,Home & Kitchen,Electrical,https://www.jiomart.com/c/groceries/home-kitchen/electrical/batteries/1693,Eveready Red 1015 AA Carbon Zinc Batteries (Pack of 10),125.0,1119.0,120.0
59,Home & Kitchen,Electrical,https://www.jiomart.com/c/groceries/home-kitchen/electrical/batteries/1693,Eveready Red 1012 AAA Carbon Zinc Batteries (Pack of 10),125.0,1119.0,120.0
60,Home & Kitchen,Electrical,https://www.jiomart.com/c/groceries/home-kitchen/electrical/batteries/1693,Nippo Gold AA UM 3DG Extra Heavy Duty Batteries (Pack of 10),109.0,1119.0,120.0
61,Home & Kitchen,Bathroom & Laundry Accessories,https://www.jiomart.com/c/groceries/home-kitchen/bathroom-laundry-accessories/buckets-mugs-tubs/1715,Princeware Super Deluxe Printed Assorted Plastic Bucket 16 L,149.0,1119.0,122.0
62,Home & Kitchen,Bathroom & Laundry Accessories,https://www.jiomart.com/c/groceries/home-kitchen/bathroom-laundry-accessories/buckets-mugs-tubs/1715,Princeware Super Deluxe Blue Plastic Bucket 16 L,149.0,1119.0,122.0
63,Home & Kitchen,Bathroom & Laundry Accessories,https://www.jiomart.com/c/groceries/home-kitchen/bathroom-laundry-accessories/buckets-mugs-tubs/1715,Joyo Better Home Blue Square Plastic Mug 1.5 L,69.0,1119.0,122.0
64,Home & Kitchen,Disposables,https://www.jiomart.com/c/groceries/home-kitchen/disposables/garbage-bags/1691,Earth Mate Compostable Garbage Bag 19x21 in (15 pcs),75.0,1119.0,80.0
65,Home & Kitchen,Disposables,https://www.jiomart.com/c/groceries/home-kitchen/disposables/garbage-bags/1691,Earth Mate Compostable Medium Size Garbage Bags 25x30 inch (10 N),99.0,1119.0,80.0
66,Home & Kitchen,Disposables,https://www.jiomart.com/c/groceries/home-kitchen/disposables/garbage-bags/1691,Crystal Compostable Garbage Bag 43x48 cm (15 pcs),65.0,1119.0,80.0
67,Home & Kitchen,Stationery,https://www.jiomart.com/c/groceries/home-kitchen/stationery/office-supplies/1699,JK Copier 75 GSM A4 Paper Rim (500 pgs),245.0,1119.0,220.0
68,Home & Kitchen,Stationery,https://www.jiomart.com/c/groceries/home-kitchen/stationery/office-supplies/1699,JK Easy Copier 70 GSM A4 Paper Rim (500 pgs),225.0,1119.0,220.0
69,Home & Kitchen,Stationery,https://www.jiomart.com/c/groceries/home-kitchen/stationery/office-supplies/1699,QwikWork Copier Paper 75 GSM A4 500 Sheets,189.0,1119.0,220.0
70,Home & Kitchen,Bags & Travel Luggage,https://www.jiomart.com/c/groceries/home-kitchen/bags-travel-luggage/trolley-suitcases/1719,TIMUS MOROCCO UPRIGHT BLACK POLYSTER TROLLEY BAG 55 CM,2199.0,1119.0,2749.0
71,Home & Kitchen,Bags & Travel Luggage,https://www.jiomart.com/c/groceries/home-kitchen/bags-travel-luggage/trolley-suitcases/1719,Safari Regloss Antiscratch Black Luggage Trolley Bag,3449.0,1119.0,2749.0
72,Home & Kitchen,Bags & Travel Luggage,https://www.jiomart.com/c/groceries/home-kitchen/bags-travel-luggage/trolley-suitcases/1719,Safari GLIMPSE Grey Polycarbonate Trolley 38 L (GLIMPSE564WGNM),2599.0,1119.0,2749.0
73,Home & Kitchen,"Mops, Brushes & Scrubs",https://www.jiomart.com/c/groceries/home-kitchen/mops-brushes-scrubs/toilet-other-brushes/1695,Gala Double Hockey Toilet Brush,135.0,1119.0,91.0
74,Home & Kitchen,"Mops, Brushes & Scrubs",https://www.jiomart.com/c/groceries/home-kitchen/mops-brushes-scrubs/toilet-other-brushes/1695,Scotch-Brite Kitchen Sink Brush + Refill,99.0,1119.0,91.0
75,Home & Kitchen,"Mops, Brushes & Scrubs",https://www.jiomart.com/c/groceries/home-kitchen/mops-brushes-scrubs/toilet-other-brushes/1695,Gala Chandra Gold Cloth Brush,40.0,1119.0,91.0
76,Home & Kitchen,Auto Care,https://www.jiomart.com/c/groceries/home-kitchen/auto-care/paint-exterior-care/1701,Motomax Cream Polish 60 g,99.0,1119.0,43.0
77,Home & Kitchen,Auto Care,https://www.jiomart.com/c/groceries/home-kitchen/auto-care/paint-exterior-care/1701,Vista Sponge Shine,13.0,1119.0,43.0
78,Home & Kitchen,Auto Care,https://www.jiomart.com/c/groceries/home-kitchen/auto-care/paint-exterior-care/1701,Motomax Insta Shine Polish in Sponge,18.0,1119.0,43.0
79,Home & Kitchen,Garden & Outdoor,https://www.jiomart.com/c/groceries/home-kitchen/garden-outdoor/gardening/2338,Crodor Vino Neem Oil 100 ml With Poly Grow Bags (5Inch x 6Inch - 25 Piece),309.0,1119.0,269.0
80,Home & Kitchen,Garden & Outdoor,https://www.jiomart.com/c/groceries/home-kitchen/garden-outdoor/gardening/2338,"Crodor IFFCO Sea Secret 200 ml, Liquid Seaweed Extract,Organic Bio-Stimulant",399.0,1119.0,269.0
81,Home & Kitchen,Garden & Outdoor,https://www.jiomart.com/c/groceries/home-kitchen/garden-outdoor/gardening/2338,National Gardens Vermicompost Organic Fertilizer for Better Plant Growth (240 g),99.0,1119.0,269.0
82,Home & Kitchen,Carpentry & work accessories,https://www.jiomart.com/c/groceries/home-kitchen/carpentry-work-accessories/adhesives-sealants/1709,Pidilite M-Seal Phata Phat 100 g,27.0,1119.0,1331.0
83,Home & Kitchen,Carpentry & work accessories,https://www.jiomart.com/c/groceries/home-kitchen/carpentry-work-accessories/locks-hardware/2676,Plantex Grey & White High Grade Heavy Steel Folding Ladder with 4 Anti Skid Steps for Home,3499.0,1119.0,1331.0
84,Home & Kitchen,Carpentry & work accessories,https://www.jiomart.com/c/groceries/home-kitchen/carpentry-work-accessories/locks-hardware/2676,Godrej Locks Brass Brass Navtal 3279 Padlock Set,468.0,1119.0,1331.0
85,Home & Kitchen,Pooja Needs,https://www.jiomart.com/c/groceries/home-kitchen/pooja-needs/lamp-lamp-oil/1722,Cycle Om Shanti Chandanam Pooja Oil 1 L,179.0,1119.0,172.0
86,Home & Kitchen,Pooja Needs,https://www.jiomart.com/c/groceries/home-kitchen/pooja-needs/lamp-lamp-oil/1722,Mangalmai Til Diya and Lamp Oil 900 ml,169.0,1119.0,172.0
87,Home & Kitchen,Pooja Needs,https://www.jiomart.com/c/groceries/home-kitchen/pooja-needs/lamp-lamp-oil/1722,Pitambari Deepshakti Diya and Lamps Pooja Oil 900 ml,169.0,1119.0,172.0
88,Home & Kitchen,Bathroom & Laundry,https://www.jiomart.com/c/groceries/home-kitchen/bathroom-laundry/laundry-accessories/2361,Kuber Industries Maroon Disney Mickey Mouse Print Foldable Storage Cube With Handle 33 cm x 33 cm,299.0,1119.0,582.0
89,Home & Kitchen,Bathroom & Laundry,https://www.jiomart.com/c/groceries/home-kitchen/bathroom-laundry/laundry-accessories/2361,Kuber Industries Red Disney Cars Print Fabric Foldable Storage Cube with Handle (Pack of 4),1149.0,1119.0,582.0
90,Home & Kitchen,Bathroom & Laundry,https://www.jiomart.com/c/groceries/home-kitchen/bathroom-laundry/laundry-accessories/2361,Kuber Industries Pink Disney Minnie Print Foldable Cloth Storage Cube With Handle 33 cm x 33 cm,299.0,1119.0,582.0
91,Home & Kitchen,Industrial & Scientific Supplies,https://www.jiomart.com/c/groceries/home-kitchen/industrial-scientific-supplies/personal-protective-equipment/3380,"CENWELL 50 Pcs Blue 3 Ply Surgical Mask with Nose Pin, Ultrasonic Ear loops and Saver Strap, Melt Blown Layer (Box Sealed Packing)",249.0,1119.0,284.0
92,Home & Kitchen,Industrial & Scientific Supplies,https://www.jiomart.com/c/groceries/home-kitchen/industrial-scientific-supplies/personal-protective-equipment/3380,"CENWELL 100 Pcs Blue 3 Ply Surgical Mask with Nose Pin, Ultrasonic Ear loops and Saver Strap, Melt Blown Layer (Box Sealed Packing)",299.0,1119.0,284.0
93,Home & Kitchen,Industrial & Scientific Supplies,https://www.jiomart.com/c/groceries/home-kitchen/industrial-scientific-supplies/personal-protective-equipment/3380,"Medinain Disposable With Built-In Adjustable Nose Pin, 95 Percentage, Filtration CE, and ISO and WHO-GMP Certified Surgical Face Mask (Pack-100)",303.0,1119.0,284.0
94,Home & Kitchen,Building Supplies & Measuring Tools,https://www.jiomart.com/c/groceries/home-kitchen/building-supplies-measuring-tools/air-quality-tester/5423,PCE Instruments Air Quality Meter PCE-PTH 10,10000.0,1119.0,10000.0
95,Home & Kitchen,Hardware & Plumbing,https://www.jiomart.com/c/groceries/home-kitchen/hardware-plumbing/hook-and-loop-fasteners/5461,"ELITEHOME Set of 10 Plastic Silver Wall Hooks, Magic Sticker Hooks, Self Adhesive Hooks for Keys",179.0,1119.0,276.0
96,Home & Kitchen,Hardware & Plumbing,https://www.jiomart.com/c/groceries/home-kitchen/hardware-plumbing/hook-and-loop-fasteners/5461,"ELITEHOME Stainless Steel Wall Hook Sticker For Hanging Hooks For Wall,Sticky Self Adhesive Hooks",399.0,1119.0,276.0
97,Home & Kitchen,Hardware & Plumbing,https://www.jiomart.com/c/groceries/home-kitchen/hardware-plumbing/hook-and-loop-fasteners/5461,"ELITEHOME Heavy Duty Wall Hooks Self Adhesive Hooks For Kitchen, Bathroom Hooks For Wall Sticky Hooks",249.0,1119.0,276.0
98,Home & Kitchen,Home Safety & Automation,https://www.jiomart.com/c/groceries/home-kitchen/home-safety-automation/safes-accessories/5418,"Ozone Black Jade Safe, 26 L",11432.0,1119.0,9965.0
99,Home & Kitchen,Home Safety & Automation,https://www.jiomart.com/c/groceries/home-kitchen/home-safety-automation/safes-accessories/5418,"Ozone Black Jade 01 Safe, 9.8 L",7912.0,1119.0,9965.0
100,Home & Kitchen,Home Safety & Automation,https://www.jiomart.com/c/groceries/home-kitchen/home-safety-automation/safes-accessories/5418,Ozone Safilo Bio-Z,10552.0,1119.0,9965.0
101,Home & Kitchen,Kitchen & Bath Fixtures,https://www.jiomart.com/c/groceries/home-kitchen/kitchen-bath-fixtures/bathroom-fixtures/5500,"Self Adhesive Tissue Toilet Paper Holder with Mobile Phone Storage Shelf, Wall-Mounted Paper Towel Storage Rack Bathroom Wall Shelf (White, Tissue Holder with Mobile Stand)",349.0,1119.0,416.0
102,Home & Kitchen,Kitchen & Bath Fixtures,https://www.jiomart.com/c/groceries/home-kitchen/kitchen-bath-fixtures/bathroom-fixtures/5500,U-S-F BATH ACCESSORIES Silver Stainless Steel Towel Holder,399.0,1119.0,416.0
103,Home & Kitchen,Kitchen & Bath Fixtures,https://www.jiomart.com/c/groceries/home-kitchen/kitchen-bath-fixtures/bathroom-fixtures/5500,U-S-F BATH ACCESSORIES Silver Metal Towel Holder,499.0,1119.0,416.0
104,Home & Kitchen,"Paint, Wall Treatments & Supplies",https://www.jiomart.com/c/groceries/home-kitchen/paint-wall-treatments-supplies/painting-supplies-tools/5434,Asian Paints Aqua Blue Polypropelene Disposable Foot Cover (Pack Of 25),956.0,1119.0,1265.0
105,Home & Kitchen,"Paint, Wall Treatments & Supplies",https://www.jiomart.com/c/groceries/home-kitchen/paint-wall-treatments-supplies/painting-supplies-tools/5434,Asian Paints Multicolor Fan Deck Spectra Cosmos,2000.0,1119.0,1265.0
106,Home & Kitchen,"Paint, Wall Treatments & Supplies",https://www.jiomart.com/c/groceries/home-kitchen/paint-wall-treatments-supplies/painting-supplies-tools/5434,Asian Paints White Coating Paint - 1L,840.0,1119.0,1265.0
107,Home & Kitchen,Power & Hand Tools,https://www.jiomart.com/c/groceries/home-kitchen/power-hand-tools/hand-tools/5456,ACHRO Combo Pack of 3 Tool Kits Set for Home,449.0,1119.0,459.0
108,Home & Kitchen,Power & Hand Tools,https://www.jiomart.com/c/groceries/home-kitchen/power-hand-tools/hand-tools/5456,ACHRO CR-V Steel Plier Set Pack of 3,499.0,1119.0,459.0
109,Home & Kitchen,Power & Hand Tools,https://www.jiomart.com/c/groceries/home-kitchen/power-hand-tools/hand-tools/5456,Stapler for soft wood,429.0,1119.0,459.0
110,Home & Kitchen,Handloom & Handicraft,https://www.jiomart.com/c/groceries/home-kitchen/handloom-handicraft/blanket-quilts-dohars/5847,Fanusta Jaipuri Hand Block Print Mulmul Quilt Double AC Blanket Razai,3499.0,1119.0,2582.0
111,Home & Kitchen,Handloom & Handicraft,https://www.jiomart.com/c/groceries/home-kitchen/handloom-handicraft/blanket-quilts-dohars/5847,Fanusta Green Jaipuri Hand Block Print Mulmul Quilt Single AC Blanket,1999.0,1119.0,2582.0
112,Home & Kitchen,Handloom & Handicraft,https://www.jiomart.com/c/groceries/home-kitchen/handloom-handicraft/blanket-quilts-dohars/5847,"Fanusta Geometric Print Mulmul Quilt, AC Blanket Single",2249.0,1119.0,2582.0
113,Home & Kitchen,Personal Wear,https://www.jiomart.com/c/groceries/home-kitchen/personal-wear/women-undergarments/5784,Women Full Coverage Non Padded Bra (White),250.0,1119.0,250.0
114,Fashion,Men,https://www.jiomart.com/c/fashion/men/clothing-accessories/497,Pack of 3 Patterned Socks,254.0,465.0,549.0
115,Fashion,Men,https://www.jiomart.com/c/fashion/men/clothing-accessories/497,Mensome Blue Cotton Silk Neck Tie Gift Set in Wooden Box,1195.0,465.0,549.0
116,Fashion,Men,https://www.jiomart.com/c/fashion/men/clothing-accessories/497,"SLIMSHINE Men's & Women's Cotton Solid Loafer Socks, Pack of 4 ( Blue, Black, Grey, Silver )",199.0,465.0,549.0
117,Fashion,Women,https://www.jiomart.com/c/fashion/women/ethnic-wear/494,Indibelle Purple White Womens Rayon Floral Print Flared Kurta (M),1080.0,465.0,613.0
118,Fashion,Women,https://www.jiomart.com/c/fashion/women/ethnic-wear/494,Dsk Studio Women Green All over print Crepe Kurta,229.0,465.0,613.0
119,Fashion,Women,https://www.jiomart.com/c/fashion/women/ethnic-wear/494,Liklee Women Green Solid Satin Saree,529.0,465.0,613.0
120,Fashion,Boys,https://www.jiomart.com/c/fashion/boys/western-wear/500,NEW GEN Boys Green Printed Cotton Dungaree,277.0,465.0,355.0
121,Fashion,Boys,https://www.jiomart.com/c/fashion/boys/western-wear/500,Graphic Print Crew-Neck T-shirt,125.0,465.0,355.0
122,Fashion,Boys,https://www.jiomart.com/c/fashion/boys/western-wear/500,KUCHIPOO Boys Multi Color Printed Cotton Blend Pack of 5 Tshirts,664.0,465.0,355.0
123,Fashion,Girls,https://www.jiomart.com/c/fashion/girls/western-wear/564,IndiWeaves Girls Cotton Printed Capri 3/4th Pants (Pack of 8),899.0,465.0,642.0
124,Fashion,Girls,https://www.jiomart.com/c/fashion/girls/western-wear/564,IndiWeaves Girls Cotton Printed Capri 3/4th Pants (Pack of 6),799.0,465.0,642.0
125,Fashion,Girls,https://www.jiomart.com/c/fashion/girls/western-wear/564,KAARIGARI Girls Red Solid Net Dress,229.0,465.0,642.0
126,Fashion,Junior Boys,https://www.jiomart.com/c/fashion/junior-boys/western-wear/520,Looper Placement Typographic Print Shorts,251.0,465.0,279.0
127,Fashion,Junior Boys,https://www.jiomart.com/c/fashion/junior-boys/western-wear/520,Looper Placement Typographic Print Shorts,251.0,465.0,279.0
128,Fashion,Junior Boys,https://www.jiomart.com/c/fashion/junior-boys/western-wear/520,Mid-Rise Bermuda Shorts with Insert Pockets,335.0,465.0,279.0
129,Fashion,Infants,https://www.jiomart.com/c/fashion/infants/western-wear/551,T-shirt with Dress Set,349.0,465.0,351.0
130,Fashion,Infants,https://www.jiomart.com/c/fashion/infants/western-wear/551,Dungarees with Printed T-shirt,356.0,465.0,351.0
131,Fashion,Infants,https://www.jiomart.com/c/fashion/infants/western-wear/551,Spider Man Print Bodysuit,349.0,465.0,351.0
132,Electronics,Mobiles & Tablets,https://www.jiomart.com/c/electronics/mobiles-tablets/smartphones/777,"Samsung Galaxy M52 128 GB, 8 GB RAM Icy Blue, Mobile Phone",21999.0,26204.0,22332.0
133,Electronics,Mobiles & Tablets,https://www.jiomart.com/c/electronics/mobiles-tablets/smartphones/777,"OnePlus Nord CE 2 Lite 5G,128 GB,6 GB RAM,Black Dusk,Mobile Phone",19999.0,26204.0,22332.0
134,Electronics,Mobiles & Tablets,https://www.jiomart.com/c/electronics/mobiles-tablets/smartphones/777,"OnePlus Nord CE 2 5G 128 GB, 8 GB RAM, Blue, Mobile Phone",24999.0,26204.0,22332.0
135,Electronics,TV & Speaker,https://www.jiomart.com/c/electronics/tv-speaker/televisions/783,"TCL 81.28 cm (32 inch) 2Yr Warranty HD LED TV, D311T Series, 32D311T",12999.0,26204.0,13499.0
136,Electronics,TV & Speaker,https://www.jiomart.com/c/electronics/tv-speaker/televisions/783,"ONEPLUS 81.28 cm (32 inch) HD Smart LED TV, 32Y1",14499.0,26204.0,13499.0
137,Electronics,TV & Speaker,https://www.jiomart.com/c/electronics/tv-speaker/televisions/783,"Kodak 80 cm (32 inch) HD Ready LED Smart TV, 7XPRO Series 32HDX7XPRO, Quad Core Processor, Built-in Chromecast",12999.0,26204.0,13499.0
138,Electronics,Computers,https://www.jiomart.com/c/electronics/computers/laptops/775,Asus EC312WS VivoBook Flip 14 Convertible Laptop(11th Gen Intel Core i3-1115G4/8GB/?512GB SSD/Intel UHD Graphics/?Windows 11/Full HD) 35.56 cm (14 Inch),51999.0,26204.0,35956.0
139,Electronics,Computers,https://www.jiomart.com/c/electronics/computers/laptops/775,"Lenovo 95IN Ideapad 1 Laptop (Intel Celeron N4020/4GB/256GB SSD/Intel UHD Graphics/Windows 11/MSO/HD), 29.46 cm (11.6 inch)",23890.0,26204.0,35956.0
140,Electronics,Computers,https://www.jiomart.com/c/electronics/computers/laptops/775,"HP 14s-dq3033TU Laptop (Intel Pentium Silver N6000/8GB/256GB SSD/Intel UHD Graphics/Windows 11/MSO/HD), 35.6 cm (14 inch)",31979.0,26204.0,35956.0
